anime_id,top_review
99147,"# [~~~This review will contain Spoilers for the show!~~~]()

An amazing season, animation and story wise. This is where things get real good.

[(SPOILER AHEAD) STORY:]()
This season focuses on learning the secrets of the monarchy that rules over the area within the walls.

All of the secrets hidden from us, and even the citizens inside the show are all coming loose. This season was honestly so good, my 2nd favourite to be honest.
The way they handled the story and the animation was phenomenal.

A lot of things happen this season, we don't get to see a lot of Titan fighting but thats because we know that the real enemy is other people. The Kenny squad is equipped with shotguns with what seems to be updated version of the maneuver gear built into them. This adds such a new and great dynamic into the combat scenes.

After all of the amazing fighting between the Survery Corps and Kenny Squad we are greeted with the Royal Family (The Reiss Family). They are the true kings of the world. Meaning that Krista (which we learned her real name is Historia Reiss) is the true queen of the world, that is after defeating her angered dad. I said angered because she refused to take part in the ceremony of injecting the fluid and eating the carrier of the Titan Eren has, she saved him and therefor her father sucked up the juices of the Titan on the floor and became the biggest Titan we have seen.

Near the end of the season we are greeted with Keith, the lad who was training Eren and the rest in Season 1. He knows more than he leads on to. He wanted to protect Eren that's why Eren's gear didn't work during the test in Season 1. I honestly loved all of that, all of the little plot twists which seemed like nothing important at first but then built up gradually to unveil such a massive story.

This season originally was supposed to be two cour but the second part was delayed, which yes at the time I was really impatient and wanted the second half now I am glad they took their time cause Part 2 is 10000x more intense. Get Excited!
~~~img420(https://i.makeagif.com/media/7-23-2018/DJeMEc.gif)~~~



[CHARACTERS:]()
The characters matured quite a lot during the span of the season.

Not only that their appearance changed slightly but also their lil quirks.
Of course they still are the same ol' characters we fell in love with in Season 1 but they are much more serious now.

I won't be talking much about the already existing characters such as Levi and Mikasa but instead will be focusing on the new major ones, I also already talked about the changes that happened to Keith and Krista in the previous section so I won't go over them again here. Sorry lads.

First up is Kenny. He is the one who took care of Levi when he was younger. His fighting style is similar that to Levi's (go figure). His character seems much more playful, I suppose, though he is quite serious about his job (which is to eliminate the Survey Corps). He also knows quite a few secrets from the past about the Royal Blood.

Flagel Reeves, he is the son of Dimo Reeves. After the assassination of his father due to the betrayal. Flegel has been huge help to Survery Corps, with not only getting their plans to go smoothly but also few other things.

We also get a lil sneek peek at the back story of Grisha (the father of Eren).
~~~img420(https://thumbs.gfycat.com/BlaringRawCollardlizard-sizerestricted.gif)~~~



[ART/ANIMATION:]()
The animation of the previous two seasons was great, but this season takes it up to 11.

The smooth motions between each frame and each movement in combat is so well done that I honestly rewatched each and every one of these scenes hundreds of times. My favourite scene out of this whole season has to be the one near the start, the chase between Levi and Kenny Squad.

The art style also got a new coat of paint, it looks much more realistic-ish, which is also a nice change, it adds to the combat just that much more due to the detail.
~~~img420(https://steamuserimages-a.akamaihd.net/ugc/945082312481287020/205E342F94D33BAA0DE200A0700B3BCD54F79ED6/)~~~



[MUSIC:]()
Shingeki no Kyojin has an amazing OST everytime, this goes without saying. 
This Season is no different, the intense music during the all scale fights were adrenaline inducing, the calm tracks which appeared in the resting areas of the show where amazing at getting that adrenaline out and make you calm before it kicked you in the gut with more fights so well done it should be a crime.
~~~img420(https://thumbs.gfycat.com/InformalDirectIrishsetter-sizerestricted.gif)~~~



[OVERALL OPINION:]()
Season 3 Part 1 is amazing, not only the animation and OST but also the story.
All of the lies and facades are crumbling down from the old kings, the truth is being exposed to everyone.
I honestly had so many moments during this season where I had to pause and appreciate the amazing writing of this series.

Part 2 tho, oh lawd. That just takes it up to another level. Get Excited!"
21856,"I have never been a fan of shounen anime, but dear God if this isn't one of the best shows to come out in the past few years. My gripes with the genre are consistently made to seem completely unfounded every week as new episodes air. To have a shounen manga adaptation clip along at a decent pace is already an impressive feat, but to also include incredible characters, stellar animation, and great music is just a medium-shattering achievement, especially when the series came straight out of SHONEN JUMP. The last I remember having this much pure unadulterated hype and fun with shounen was with YuYu Hakusho back when it aired on Toonami, and there's something to be said for recapturing (and going above) that magic. Oh, did I mention yet that there's nearly no filler? Yeah, there's only ONE anime-original episode, and the only way you'd even pick it out was if you were an avid manga reader. 

It's been said to death by the anime community at large, but the secret to HeroAca's quality is in its perfect execution of what we already expect. You're going to get all of your standard shounen tropes here; HeroAca embraces them to the fullest degree. The difference is in HOW the show does them, and does them so, so, so right. Deku is the most compelling shounen main character I've encountered to date, with, for possibly the first time in shounen history, a believable reason to actually be considered an underdog. You can't help but empthaize with him in his struggles and be hype as all hell for his achievements, and the same can be said for the rest of the cast as well. So much obvious loving time and care was put into making our core cast feel like actual fucking characters instead of power-husk show-offs. Personality-rich, driven, and (most importantly) believable characters are the name of the game here, and I can't help but enjoy pretty much every character that gets any ounce of screentime.

None of this is to say that HeroAca, and by extension this second season, is perfect by any metric. There are some misgivings with the plot and some of the general anime ""bleh"" that plagues all releases to come out within the past several years (high school setting, etc...). World-building is also a little suspect, and there's a clear requirement of being able to both suspend disbelief and to not question the lack of exposition regarding the character's environment. This issue is especially notable when the show likes to play with the idea of the ""ideal"" of being a ""real hero"", with some heavy handed messages about how widespread power has warped public perception about what being a hero really is and what sort of behavior they should exhibit. Although an interesting and compelling discussion for HeroAca, it's heavily damaged by this lack of meaningful exposition, and can come across as misplaced and even boring if you haven't properly ""bought-in"" to the series. 

Still, if we're talking in-genre here, and if you've been with me for this song-and-dance before you know we always are, you'll be hard pressed to find anything better than this. If you have ever been a fan of shounen anime, or you are just looking for an new pick-up with a fair bit of content on the bone, I implore you to check this one out. Whether you end up watching it or just dive straight into the manga, you definitely won't be disappointed."
101759,"With The Promised Neverland wrapping up its first season this week, the only thing I can say about this series is ""WOW!"" Suspenseful, gripping, at times heartwrenching, and with enough cliffhangers to make you feel like you're a mountain climber. 

The art is phenomenal and the sound design is great. More importantly, the direction was on point from beginning to end. All of this culminated in a great viewing experience that kept me on the edge of my seat through all 12 weeks of the season. The chess-like mind games and one-up-manship from both sides made it interesting to watch and made you want to know see what the other sides plan was every time something happened. 

The characters from nearly top to bottom are fleshed out and have their own individual quirks. The three main characters, Emma, Ray, and Norman all brings something different and unique to the table and really feed off of each other when it comes to conversations and planning. This trio makes for an interesting dynamic, especially during times where trust is at an all-time low among everyone. Even when each character holds their own personal beliefs you never once feel like a person's feelings are unwarranted. Each character brings up strong points as to why they are right and that is a good indication as to why this series is so good. I'm no manga reader and for me, I think I might just stick to being an anime only for now. The twists and turns give me life when I have to wait to see what happens next. 

With a series like this there are so many ways that things can go wrong quickly. One slip up, one continuity error and a lot of that suspense can go down the drain. That is just a testament as to why this show is so good. A plan is always in motion whether the view can see is happening or not and that is what gives this show its charm. The writing always has to be on point or else things fall apart.

The last episode gave a me a very satisfied feeling that also left me wanting to know what comes next for our band of mischief kids and it makes me excited to see what comes after. The last episode gave some insightful character development to a character that I won't name to avoid spoilers but it was very much needed and changed my view on that character entirely. This last episode just felt like I had been sitting holding my breath for the past 12 weeks and only now I can breath easily. It's not very often that I feel that way about a show and it leaves me happy.

With all of that said, I look forward to next season and what the future holds for our group of precocious kids."
110277,"Attack on Titan is a modern masterpiece. Its not just a piece of fiction which has thrown quality season after season, its also one of the very few anime to have broken into the mainstream, so much so that people who do not watch anime at all have experienced and loved it. The emergence of the first season of Attack on Titan drove the series popularity to levels rarely seen before in the medium. The long wait before the release of season 2 was a major reason (along with certain pacing issues with the manga at the time) for the dying interest in the series at the time. By the time S2 aired, Attack on Titan wasnt the global phenomenon anymore. One Punch Man had broken the mold in a similar vein to AoT S1 and become the new big anime amongst casuals and non anime watchers.

Then came Season 3, and the series was roaring back. The interest in the series had never been higher, and fans flocked back in droves to have their questions answered. Many began viewing the first two seasons in new light once the revelations showcased the intricate planning and immense foreshadowing that had gone under their noses when theyd watched it first. For me, Attack on Titan was always great. Never has an anime made me feel so hopeless if I viewed the world from the perspective of the characters. The absolute mystery surrounding the titans for most of the first season along with stunning animation for fights, memorable OST for almost any scene and emotional dialogue delivered by passionate voice actors made for an unforgettable experience. Season 2 and 3 bring in more revelations, slowly unfolding the mysteries of the world and the titans and shifting the themes of the series. Season 4 has another tonal shift - much greater than previous ones - and it handles it with aplomb.

img(https://i.imgur.com/m8W6j5p.jpg)

A change in studios has often led anime series to ruin. The aforementioned OPM was one of the recent big victims of it, but other popular series like Seven Deadly Sins have also suffered due to it and never recovered.

Fortunately, MAPPA have handled the transition well. They havent been perfect (more on that later), but all in all, theyve done a good job producing a new season of what is probably the most popular anime of the last decade.

The start of S4 might have left some people wondering where the original cast went. Theres not just a change of cast in the first few episodes, but also a switch in perspectives. Were no longer seeing things from the side of Paradis and the Scouts. Instead, we now see it from the view of Marleys warriors, whore training to inherit the titans from their predecessors once their time runs out. Gabi and Falco want to inherit the armor but Reiner, i.e. the plot armored titan (Sorry, had to use this once I saw it on Reddit) cant catch a break. Someone, grant him his wish to die.

Erens growth as a character is one of the highlights of Attack on Titan as a series. He wasnt always a fan favorite because of his hotheaded nature, but as time went on, his perspective of the things around him changed, most noticeably multiple times throughout season 3. Come season 4, his character undergoes a paradigm shift; calm and sympathetic, yet ruthless. As his famous quote goes, I wont stop moving forward until all my enemies are destroyed. Hes a lot more distant, not just to everyone else in the show but also to the viewers. Unlike previous seasons, his thoughts are a mystery and the season clearly displays the divide between him and the other old Scouts. 

img(https://i.imgur.com/bs8JkDy.png)

The handling of his growth as a person and a titan shifter is outstanding, firstly in the manga and then in the anime. Yuki Kaji, the voice actor, supported this exponential growth by exceeding expectations on character delivery. I especially love how well hes transitioned seamlessly along with Eren as a character and nailed almost every line. Theres hardly a line Eren has spoken in season 4 that isnt extremely significant to the story.

Oh Gabi! Where do I even begin? Shes supposed to be the female parallel to pre timeskip Eren, but apart from some core traits like being stubborn, she isnt really that similar to him. Gabi hates the Eldians from Paradis for no other reason other than that she thinks theyre devils and should suffer for the crimes of their ancestors. Eren was stubborn, headed into almost unwinnable battles without a second thought. However, his reasons to hate the titans were justified. His mother was eaten in front of him by a titan, his home destroyed and tens upon hundreds of his comrades butchered by titans in cold blood. He fought for his freedom, and humanitys. 

Gabi, on the other hand, hates Eldians without having seen any of them. She kills people for glory, just for some useless praise. And without spoiling anything, Ill also add that shes a hypocrite with her iconic line thats become prevalent in memes now But did you see it happen?.

img(https://i.imgur.com/bvX0Cn2.png)

In her defence, shes a twelve-year-old girl whos been brainwashed so its hard to not give her some benefit of the doubt. But boy, is she annoying! Shes actually portrayed a lot better at the start of the Marley arc in the anime than in the manga, so I didnt dislike her as much. Shes neither a bad character nor a great one, but she serves her purpose.

Onto Falco, then. My cute, lovable boy, are you sure you had the same upbringing as Gabi? Hes her polar opposite, able to empathize with his enemies and an antithesis for every one of Gabis morals. He views things from a wider angle, often showing maturity way beyond his years. He might not be as naturally gifted as Gabi but hes a whole lot more likeable. From posting letters for injured people to helping his enemies who shun him instead, this good boy has it all covered. Hes one of the beautiful things in this cruel world.

Pieck is the new waifu that every fan seems to be simping over; Reiner and Zeke share the title of best character amongst the Marleyans for me. Their internal struggles and motives, some of which are only seen by viewers, make a significant contrast to their outer persona, and this holds especially true for Zeke. 

Jean remains the character who makes the viewers question their morals because he questions his own and thats what I love about him. Hes another one whos come a long way since the cadet days.

Did you think Id have forgotten Floch? He mightve been a forgettable side character who didnt even have a distinct design before S3 P2 (Isayama has himself admitted as much), but hes one of the stars of season 4, running the show like the chad that he is. Hes an extremist and his actions are brutal; at times, it seems as if hes doing it to sate his own ego and hate towards those whove imprisoned him and his race behind the walls. But despite all this, hes one of the most entertaining characters post time skip. Hes unpredictable, spunky and has the audacity to pull off stunts that mightve had your jaws slacking on the floor more times than one. And who can forget the shh? King Floch has unquestionably engraved his name as an Attack on Titan legend. 

img(https://i.imgur.com/qg3DHVc.png)

There are so many excellent characters in Attack on Titan that the review would be too long if I talked about all of them, so Ill stop here. 

The character designs in Season 4 see a distinct change, and thats not all to do with the timeskip or the change in the studio. Its a mixture of both. To anyone whos read the earlier chapters of the Attack on Titan manga, its no secret that the art at the start was mediocre. Wit Studio did a great job of enhancing the character designs and the art in general, especially in S1.

MAPPA on the other hand have stuck closer to the manga art style for characters (apart from beautifying Armin as compared to the manga, their reasons for which Id like to know). So theres a slight change in the art style because theyre following Isayamas art a lot more closely.



The animation of S4 has been the most talked about point, and for good reason. Ill mince no words: some of the CGI was downright terrible. There was some genuinely impressive CGI like the Jaw titan, but some very important scenes involving the Attack Titan and Beast Titan were horrendous. Its not the animators whore to blame for this but the greed of the production committee and the manga publishers who wanted to have S4 airing before the end of the manga to boost sales.

>An ODM animation from Season 3:
img(https://media.giphy.com/media/b8eOj46ufZaw3zINwk/giphy.gif)



For almost any other anime, I wouldve let even the terrible CGI scenes slide, but this is Attack on Titan, one of the most popular and highly acclaimed anime ever, and surely it deserved the best treatment possible. Unfortunately, it didnt get that. Does it make the season bad? Of course not since the season covers one of the best arcs in the manga and the adaptation itself was faithful with top tier voice acting. Could better animation elevate S4 of Attack on Titan to higher levels? Greatly.

>A Comparison of S1 vs. S4 Titan Movements:

>Season 1
img(https://media.giphy.com/media/DmBcBJoAtgf25nfMqn/giphy.gif)

>Season 4:
img(https://media.giphy.com/media/fGpJbOD2IXpV8dJHho/giphy.gif)

My biggest problem with the titan CGI was that it just broke immersion. One moment we had fluid 2D animation, the other we had some janky CGI lacking weight, which made me pause and check if I was still watching Attack on Titan. Ive re-watched these scenes multiple times and every time, I came to the same conclusion: Attack on Titan deserves better. Remember the marvelous scenes with ODM gear we got in the first three seasons or the titan fights or Levi vs the Beast Titan? Unfortunately, we dont get that level of animation in season 4, and while understandable given the time constraints, its disappointing nevertheless.

The CGI wasnt always as bad, but had enough prevalence in the most important moments (Eg: Attack Titan vs Warhammer Titan) to be a stain on an otherwise stellar season.
 
 
We have some new and honestly breathtaking tracks added to the already great OST from S1 - S3. One of the highlights in the sound composition this season is that there were different composers depending on whose perspective a scene is shown from. For Paradis, we have Hiroyuki Sawano back with all our favorites from previous seasons while Kohta Yamomoto handled the Marleyan side, giving us bangers including Ashes on the Fire. I missed the old OST in the first few episodes because I was worried theyd underuse S1-S3 OST, but they did not. It wasnt used much because the initial episodes take place from the perspective of the Marleyans. Honestly, having different composers for either side of the conflict seems like a superb choice and helps immersion. 

The only real criticism I have about the sound was the OST choice in some scenes in the latter part of the season. And no, Im not talking about the basement scene here. I thought the basement scene OST choice was great.

Similar to the OST, it took a while for me to warm up to the OP, but looking back now, its great and suits the themes of S4. This was a common opinion amongst the community; the majority seemed to have disliked My War for the first couple episodes, then it just grew on people and now it sets the tone for the rest of the episode.

Now that Attack on Titans final season (Part 1) has ended, itll be intriguing to see what route MAPPA takes for the rest of the adaptation. Theres anywhere between 13-16 episodes of content left to cover, depending on the pacing. Will the production committee see Attack on Titan as a chance to make hundreds of millions of dollars in a movie format or will we have Attack on Titan Final Season Part 2 (lol), only time will tell. Im not against either, as long as they take enough time and pour passion into making it. I dont mind waiting longer if it means getting the best production values. Hopefully, thats the case."
